Ombudsstelle Geschlossene Fonds e. V.;Verbraucherstreitbeilegungsgesetz;https://www.bmjv.de/SharedDocs/Gesetzgebungsverfahren/DE/Verbraucherstreitbeilegungsgesetz_ADR_Richtlinie.html;23. Jan 15;https://www.bmjv.de//SharedDocs/Gesetzgebungsverfahren/Stellungnahmen/2015/Downloads/01232015_Stellungnahme_Ombudsstelle_Geschlossene_Fonds_RefE_Verbraucherstreitbeilegungsgesetz_ADR_Richtlinie.pdf?__blob=publicationFile&v=1;NA;NA;
ONE Deutschland;Bilanzrichtlinie-Umsetzungsgesetz - (BilRUG);https://www.bmjv.de/SharedDocs/Gesetzgebungsverfahren/DE/Bilanzrichtlinie_Umsetzungsgesetz.html;02. Okt 14;https://www.bmjv.de//SharedDocs/Gesetzgebungsverfahren/Stellungnahmen/2014/Downloads/10022014_Stellungnahme_ONE_RefE_BilRUG.pdf?__blob=publicationFile&v=3;15/3442;4960;
Open Nine Pub Musikverlag, Rüdiger Grothues;Gesetz zur Umsetzung der Richtlinie 2014/26/EU über die kollektive Wahrnehmung von Urheber- und verwandten Schutzrechten und die Vergabe von Mehrgebietslizenzen für Rechte an Musikwerken für die Online-Nutzung im Binnenmarkt sowie zur Änderung des Verfahrens betreffend die Geräte- und Speichermedienvergütung;https://www.bmjv.de/SharedDocs/Gesetzgebungsverfahren/DE/VG_Richtlinie_Umsetzungsgesetz.html;14. Aug 15;https://www.bmjv.de//SharedDocs/Gesetzgebungsverfahren/Stellungnahmen/2015/Downloads/08142015_Stellungnahme_ONP_RefE_VG_Richtlinie_Umsetzungsgesetz.pdf?__blob=publicationFile&v=1;18/7223;NA;
Opferperspektive e. V. - Beratungsstellen Betroffener rechter, rassistischer und antisemitischer Gewalt;Gesetz zur Umsetzung von Empfehlungen des NSU-Untersuchungsausschusses des Deutschen Bundestages;https://www.bmjv.de/SharedDocs/Gesetzgebungsverfahren/DE/Umsetzung_Empfehlung_NSU_Untersuchungsausschuss_BT.html;20. Jul 14;https://www.bmjv.de//SharedDocs/Gesetzgebungsverfahren/Stellungnahmen/2014/Downloads/07202014_Stellungnahme_Opferperspektive_RefE_Umsetzung_Empfehlung_NSU_Untersuchungsausschuss_BT.pdf?__blob=publicationFile&v=1;NA;NA;
Organisationsbüro Strafverteidigervereinigungen;Gesetz zur Stärkung des Rechts des Angeklagten auf Anwesenheit in der Verhandlung;https://www.bmjv.de/SharedDocs/Gesetzgebungsverfahren/DE/Gesetz_zur_Staerkung_Recht_des_Angeklagten_auf_Anwesenheit_Verhandlung.html;29. Mai 18;https://www.bmjv.de//SharedDocs/Gesetzgebungsverfahren/Stellungnahmen/2018/Downloads/05182018_Anwesenheit_Verhandlung_straf_vv.pdf?__blob=publicationFile&v=3;NA;NA;
Oxford Committee for Famine Relief (Oxfam);Gesetz zur Stärkung der nichtfinanziellen Berichterstattung der Unternehmen in ihren Lage- und Konzernlageberichten (CSR-Richtlinie-Umsetzungsgesetz);https://www.bmjv.de/SharedDocs/Gesetzgebungsverfahren/DE/CSR-Richtlinie-Umsetzungsgesetz.html;15. Apr 16;https://www.bmjv.de//SharedDocs/Gesetzgebungsverfahren/Stellungnahmen/2016/Downloads/04152016_Stellungnahme_Oxfam_RefE_CSR_Umsetzungsgesetz.pdf?__blob=publicationFile&v=3;NA;NA;
Oxford Committee for Famine Relief (Oxfam), Berichtspflichten Gutachten;Gesetz zur Stärkung der nichtfinanziellen Berichterstattung der Unternehmen in ihren Lage- und Konzernlageberichten (CSR-Richtlinie-Umsetzungsgesetz);https://www.bmjv.de/SharedDocs/Gesetzgebungsverfahren/DE/CSR-Richtlinie-Umsetzungsgesetz.html;15. Apr 16;https://www.bmjv.de//SharedDocs/Gesetzgebungsverfahren/Stellungnahmen/2016/Downloads/04152016_Oxfam_ANLAGE_20150622Berichtspflichten_Gutachten_RefE_CSR_Umsetzungsgesetz.pdf?__blob=publicationFile&v=5;NA;NA;
Paritätischer Gesamtverband;Gesetz zur Änderung der materiellen Zulässigkeitsvoraussetzungen von ärztlichen Zwangsmaßnahmen und zur Stärkung des Selbstbestimmungsrechts von Betreuten;https://www.bmjv.de/SharedDocs/Gesetzgebungsverfahren/DE/Gesetz_zur_Aenderung_materieller_Zulaessigkeitsvoraussetzungen_aerztlicher_Zwangsmassnahmen.html;03. Jan 17;https://www.bmjv.de//SharedDocs/Gesetzgebungsverfahren/Stellungnahmen/2017/Downloads/01032017_Stellungnahme_Paritaetischer_Gesamtverband_RefE_Gesetz_zur_Aenderung_materieller_Zulaessigkeitsvoraussetzungen_aerztlicher_Zwangsmassnahmen.pdf?__blob=publicationFile&v=1;NA;149;
Paritätischer Gesamtverband;Gesetz zur Novellierung des Rechts der Unterbringung in einem psychiatrischen Krankenhaus gemäß § 63 des Strafgesetzbuches;https://www.bmjv.de/SharedDocs/Gesetzgebungsverfahren/DE/Novellierung_Unterbringung_psychiatrischen_Krankenhaus_63_StGB.html;16. Jun 15;https://www.bmjv.de//SharedDocs/Gesetzgebungsverfahren/Stellungnahmen/2015/Downloads/06162015_Stellungnahme_Paritaetischer_Gesamtverband_RefE_Novellierung_Rechts_Unterbringung_psychiatrischew_Krankenhaus_Par_63_StGB.pdf?__blob=publicationFile&v=1;18/7244;149;
Paritätischer Gesamtverband;Gesetz zur Stärkung der Opferrechte im Strafverfahren (3. Opferrechtsreformgesetz);https://www.bmjv.de/SharedDocs/Gesetzgebungsverfahren/DE/Staerkung_Opferrechte_Strafverfahren.html;08. Dez 14;https://www.bmjv.de//SharedDocs/Gesetzgebungsverfahren/Stellungnahmen/2014/Downloads/12082014_Stellungnahme_Paritaetischer_Gesamtverband_RefE_Staerkung_Opferrechte_Strafverfahren.pdf?__blob=publicationFile&v=1;NA;149;
Paritätischer Gesamtverband;Gesetz zur Verbesserung der Information über einen Schwangerschaftsabbruch;https://www.bmjv.de/SharedDocs/Gesetzgebungsverfahren/DE/Information_Schwangerschaftsabbruch219a.html;31. Jan 19;https://www.bmjv.de//SharedDocs/Gesetzgebungsverfahren/Stellungnahmen/2019/Downloads/31012019_Stellungnahme_Paritaetischer-Gesamtverband_Schwangerschaft.pdf?__blob=publicationFile&v=4;NA;149;
Paritätischer Gesamtverband;Gesetzes zur Änderung des Unterhaltsrechts und des Unterhaltsverfahrensrechts sowie zur Änderung der Zivilprozessordnung und kostenrechtlicher Vorschriften   ;https://www.bmjv.de/SharedDocs/Gesetzgebungsverfahren/DE/Aenderung_Unterhaltsverfahrensrecht_Mindestunterhalt_saechliches-Existenminimum.html;08. Jul 15;https://www.bmjv.de//SharedDocs/Gesetzgebungsverfahren/Stellungnahmen/2015/Downloads/07082015_Stellungnahme_Paritaetischer_RefE_GE_Aenderung_Unterhaltsrecht.pdf?__blob=publicationFile&v=1;NA;149;
Paritätischer Gesamtverband e. V.;Gesetz zur Änderung des Sachverständigenrechts und zur weiteren Änderung des Gesetzes über das Verfahren in Familiensachen und in den Angelegenheiten der freiwilligen Gerichtsbarkeit;https://www.bmjv.de/SharedDocs/Gesetzgebungsverfahren/DE/Aenderung_Sachverstaendigenrechts_Aenderung_Gesetzes_Verfahren_Familiensachen_sowie_freiwilligen_Gerichtsbarkeit.html;10. Aug 15;https://www.bmjv.de//SharedDocs/Gesetzgebungsverfahren/Stellungnahmen/2015/Downloads/08102015_Stellungnahme_Paritaetischer_RefE_FamFG_AendG.pdf?__blob=publicationFile&v=1;18/6985;149;
Paritätischer Wohlfahrtsverband Gesamtverband e. V.;Gesetz zur Umsetzung der Entscheidung des BVerfG zur Sukzessivadoption durch Lebenspartner;https://www.bmjv.de/SharedDocs/Gesetzgebungsverfahren/DE/Sukzessivadoption.html;20. Feb 14;https://www.bmjv.de//SharedDocs/Gesetzgebungsverfahren/Stellungnahmen/2014/Downloads/02202014_Stellungnahme_Paritaetischer_Gesamtverband_RefE_Sukzessivadoption.pdf?__blob=publicationFile&v=2;NA;NA;
Patenanwaltskammer (DPAK);Gesetz zur Änderung des Designgesetzes und weiterer Vorschriften des gewerblichen Rechtsschutzes;https://www.bmjv.de/SharedDocs/Gesetzgebungsverfahren/DE/Aenderung_Designgesetz_weiterer_Vorschriften_gewerblichen_Rechtsschutzes.html;20. Aug 15;https://www.bmjv.de//SharedDocs/Gesetzgebungsverfahren/Stellungnahmen/2015/Downloads/8202015_Stellungnahme_DPAK_RefE_Aenderung_des_Designgesetzes_weitere_Vorschriften_gewerblichen_Rechtsschutzes.pdf?__blob=publicationFile&v=1;NA;NA;
Patentanwaltskammer;Gesetz zur Umsetzung der Berufsanerkennungsrichtlinie und zur Änderung weiterer Vorschriften im Bereich der rechtsberatenden Berufe;https://www.bmjv.de/SharedDocs/Gesetzgebungsverfahren/DE/Berufsanerkennungsrichtlinie.html;22. Jun 16;https://www.bmjv.de//SharedDocs/Gesetzgebungsverfahren/Stellungnahmen/2016/Downloads/06222016_Stellungnahme_PAK_RefE_Berufsanerkennungsrichtlinie.pdf?__blob=publicationFile&v=3;NA;NA;
Patentanwaltskammer;Gesetz zur Neuordnung des Rechts der Syndikusanwälte;https://www.bmjv.de/SharedDocs/Gesetzgebungsverfahren/DE/Neuordnung_Syndikusanwaelterecht.html;15. Mai 15;https://www.bmjv.de//SharedDocs/Gesetzgebungsverfahren/Stellungnahmen/2015/Downloads/05152015_Stellungnahme_PAK_RefE_Neuordnung_Syndikusanwaelterecht.pdf?__blob=publicationFile&v=1;18/5201;NA;
Patentanwaltskammer;Gesetz zur Umsetzung der Richtlinie (EU) 2016/943 zum Schutz von Geschäftsgeheimnissen vor rechtswidrigem Erwerb sowie rechtswidriger Nutzung und Offenlegung;https://www.bmjv.de/SharedDocs/Gesetzgebungsverfahren/DE/GeschGehG.html;18. Mai 18;https://www.bmjv.de//SharedDocs/Gesetzgebungsverfahren/Stellungnahmen/2018/Downloads/05182018_Stellungnahme_patentanwaltskammer_GeschGehG.pdf?__blob=publicationFile&v=1;NA;NA;
Patentanwaltskammer;Gesetz zur Umsetzung der Berufsanerkennungsrichtlinie und zur Änderung weiterer Vorschriften im Bereich der rechtsberatenden Berufe;https://www.bmjv.de/SharedDocs/Gesetzgebungsverfahren/DE/Berufsanerkennungsrichtlinie.html;30. Jun 16;https://www.bmjv.de//SharedDocs/Gesetzgebungsverfahren/Stellungnahmen/2016/Downloads/06302016_Stellungnahme_PAK_2_RefE_Berufsanerkennungsrichtlinie.pdf?__blob=publicationFile&v=3;NA;NA;
Patentanwaltskammer;Gesetz zur Umsetzung der Richtlinie (EU) 2016/943 zum Schutz von Geschäftsgeheimnissen vor rechtswidrigem Erwerb sowie rechtswidriger Nutzung und Offenlegung;https://www.bmjv.de/SharedDocs/Gesetzgebungsverfahren/DE/GeschGehG.html;18. Mai 18;https://www.bmjv.de//SharedDocs/Gesetzgebungsverfahren/Stellungnahmen/2018/Downloads/05182018_Stellungnahme_patentanwaltskammer_GeschGehG.pdf?__blob=publicationFile&v=1;NA;NA;
Patentanwaltskammer (PAK);Gesetz zu dem Übereinkommen vom 19. Februar 2013 über ein Einheitliches Patentgericht;https://www.bmjv.de/SharedDocs/Gesetzgebungsverfahren/DE/Uebereinkommen_Einheitliches_Patentgericht.html;22. Mrz 16;https://www.bmjv.de//SharedDocs/Gesetzgebungsverfahren/Stellungnahmen/2016/Downloads/03222016_Stellungnahme_PAK_RefE_Uebereinkommen_Einheitliches_Patentgericht.pdf?__blob=publicationFile&v=1;17/5125;NA;
Patentanwaltskammer (PAK);Gesetz zur Anpassung patentrechtlicher Vorschriften auf Grund der europäischen Patentreform;https://www.bmjv.de/SharedDocs/Gesetzgebungsverfahren/DE/Anpassung_patentrechtlicher_Vorschriften_nach_euopaeischer_Patentreform.html;22. Mrz 16;https://www.bmjv.de//SharedDocs/Gesetzgebungsverfahren/Stellungnahmen/2016/Downloads/03222016_Stellungnahme_PAK_RefE_Anpassung_patentrechtlicher_Vorschriften_nach_europaeischer_Patentreform.pdf?__blob=publicationFile&v=1;NA;NA;
PFAD Bundesverband der Pflege- und Adoptivfamilien e.V.;Gesetz zur Förderung der Freizügigkeit von EU-Bürgerinnen und -Bürgern sowie zur Neuregelung verschiedener Aspekte des Internationalen Adoptionsrechts;https://www.bmjv.de/SharedDocs/Gesetzgebungsverfahren/DE/Freizuegigkeit_EU.html;06. Jul 18;https://www.bmjv.de//SharedDocs/Gesetzgebungsverfahren/Stellungnahmen/2018/Downloads/07062018_PFAD_Freizuegigkeit.pdf?__blob=publicationFile&v=1;NA;NA;
Philipps-Universität Marburg, Prof. Dr. Dr. h. c. Georg Freund, Fachbereich Rechtswissenschaften;Gesetz zur Umsetzung von Empfehlungen des NSU-Untersuchungsausschusses des Deutschen Bundestages;https://www.bmjv.de/SharedDocs/Gesetzgebungsverfahren/DE/Umsetzung_Empfehlung_NSU_Untersuchungsausschuss_BT.html;16. Jul 14;https://www.bmjv.de//SharedDocs/Gesetzgebungsverfahren/Stellungnahmen/2014/Downloads/07162014_Stellungnahme_Uni_Marburg_RefE_Umsetzung_Empfehlung_NSU_Untersuchungsausschuss_BT.pdf?__blob=publicationFile&v=2;NA;NA;
Politische Interessenvertretung behinderter Frauen im Weibernetz e. V.;Gesetz zur Änderung des Strafgesetzbuches – Verbesserung des Schutzes der sexuellen Selbstbestimmung;https://www.bmjv.de/SharedDocs/Gesetzgebungsverfahren/DE/SchutzSexuelleSelbstbestimmung.html;19. Feb 16;https://www.bmjv.de//SharedDocs/Gesetzgebungsverfahren/Stellungnahmen/2016/Downloads/02192016_Stellungnahme_Weibernetz_RefE_Schutz_sexuelle_Selbstbestimmung.pdf?__blob=publicationFile&v=1;NA;NA;
Prepaid Verband Deutschland e.V. (PVD);Gesetz zur Umsetzung der Richtlinie über die Vergleichbarkeit von Zahlungskontoentgelten, den Wechsel von Zahlungskonten sowie den Zugang zu Zahlungskonten mit grundlegenden Funktionen;https://www.bmjv.de/SharedDocs/Gesetzgebungsverfahren/DE/Zahlungskonten.html;02. Okt 15;https://www.bmjv.de//SharedDocs/Gesetzgebungsverfahren/Stellungnahmen/2015/Downloads/10022015_Stellungnahme_PVD_RefE_Zahlungskonten.pdf?__blob=publicationFile&v=1;18/7204;NA;
pro familia;Gesetz zur Verbesserung der Information über einen Schwangerschaftsabbruch;https://www.bmjv.de/SharedDocs/Gesetzgebungsverfahren/DE/Information_Schwangerschaftsabbruch219a.html;04. Feb 19;https://www.bmjv.de//SharedDocs/Gesetzgebungsverfahren/Stellungnahmen/2019/Downloads/01422019_Stellungnahme_pro-familia_Schwangerschaft.pdf?__blob=publicationFile&v=2;NA;3966;
Pro Generika;Gesetz zur Bekämpfung von Korruption im Gesundheitswesen;https://www.bmjv.de/SharedDocs/Gesetzgebungsverfahren/DE/Bekaempfung_Korruption_Gesundheitswesen.html;10. Apr 15;https://www.bmjv.de//SharedDocs/Gesetzgebungsverfahren/Stellungnahmen/2015/Downloads/04102015_Stellungnahme_progenerika_RefE_Bekaempfung_Korruption_Gesundheitswesen.pdf?__blob=publicationFile&v=1;18/6446;837;
Produzentenallianz - Allianz Deutscher Produzenten - Film & Fernsehen e. V.;Gesetz zur verbesserten Durchsetzung des Anspruchs der Urheber und ausübenden Künstler auf angemessene Vergütung und zur Regelung von Fragen der Verlegerbeteiligung;https://www.bmjv.de/SharedDocs/Gesetzgebungsverfahren/DE/Urhebervertragsrecht.html;30. Dez 15;https://www.bmjv.de//SharedDocs/Gesetzgebungsverfahren/Stellungnahmen/2015/Downloads/12302015_Stellungnahme_Produzentenallianz_RefE_Urhebervertragsrecht.pdf?__blob=publicationFile&v=1;18/8625;1073;
Prof. Dr. Dr. h.c. Michael Kubiciel;Gesetz zur Verbesserung der Information über einen Schwangerschaftsabbruch;https://www.bmjv.de/SharedDocs/Gesetzgebungsverfahren/DE/Information_Schwangerschaftsabbruch219a.html;01. Feb 19;https://www.bmjv.de//SharedDocs/Gesetzgebungsverfahren/Stellungnahmen/2019/Downloads/01022019_Stellungnahme_Prof.-Kubiciel_Schwangerschaft.pdf?__blob=publicationFile&v=5;NA;NA;
Prof. Dr. Dr. h.c. mult. Jürgen Basedow, LL.M. (Harvard Univ.), Direktor Max-Planck-Institut für ausländisches und internationales Privatrecht;Gesetz zur Änderung von Vorschriften im Bereich des Internationalen Privat- und Zivilverfahrensrechts;https://www.bmjv.de/SharedDocs/Gesetzgebungsverfahren/DE/Internationales_Privat_und_Zivilverfahrensrecht.html;02. Aug 16;https://www.bmjv.de//SharedDocs/Gesetzgebungsverfahren/Stellungnahmen/2016/Downloads/08022016_Stellungnahme_Prof_Basedow_RefE_Internationales_Privat_und_Zivilverfahrensrecht.pdf?__blob=publicationFile&v=1;NA;NA;
Prof. Dr. Friedhelm Hufen - Professor für Öffentliches Recht - Staats- und Verwaltungsrecht an der Universität Mainz;Gesetz zur Dämpfung des Mietanstiegs auf angespannten Wohnungsmärkten und zur Stärkung des Bestellerprinzips bei der Wohnungsvermittlung;https://www.bmjv.de/SharedDocs/Gesetzgebungsverfahren/DE/Daempfung_Mietanstieg_Wohnungsmaerkte_Staerkung_Bestellerprinzip_Wohnungsvermittlung.html;19. Mai 14;https://www.bmjv.de//SharedDocs/Gesetzgebungsverfahren/Stellungnahmen/2014/Downloads/05192014_Stellungnahme_Hufen_RefE_MietNovG.pdf?__blob=publicationFile&v=1;NA;NA;
Prof. Dr. Hubertus Gersdorf der Universität Leipzig;Gesetz zur Verbesserung der Rechtsdurchsetzung in sozialen Netzwerken (Netzwerkdurchsetzungsgesetz – NetzDG);https://www.bmjv.de/SharedDocs/Gesetzgebungsverfahren/DE/NetzDG.html;29. Mrz 17;https://www.bmjv.de//SharedDocs/Gesetzgebungsverfahren/Stellungnahmen/2017/Downloads/03292017_Stellungnahme_Uni_Leipzig_2_RefE_NetzDG.pdf?__blob=publicationFile&v=3;NA;NA;
Prof. Dr. Hubertus Gersdorf der Universität Leipzig;Gesetz zur Verbesserung der Rechtsdurchsetzung in sozialen Netzwerken (Netzwerkdurchsetzungsgesetz – NetzDG);https://www.bmjv.de/SharedDocs/Gesetzgebungsverfahren/DE/NetzDG.html;28. Mrz 17;https://www.bmjv.de//SharedDocs/Gesetzgebungsverfahren/Stellungnahmen/2017/Downloads/03282017_Stellungnahme_Uni_Leipzig_RefE_NetzDG.pdf?__blob=publicationFile&v=2;NA;NA;
Prof. Dr. Joachim Renzikowski (Universität Halle);Gesetz zur Bekämpfung des Menschenhandels und Schutz seiner Opfer;https://www.bmjv.de/SharedDocs/Gesetzgebungsverfahren/DE/Bekaempfung_Menschenhandels_Schutz_Opfer.html;18. Nov 14;https://www.bmjv.de//SharedDocs/Gesetzgebungsverfahren/Stellungnahmen/2014/Downloads/11182014_Stellungnahme_Renzikowski_RefE_Bekaempfung_Menschenhandel.pdf?__blob=publicationFile&v=1;NA;NA;
Prof. Dr. jur. Eric W. Steinhauer - Humboldt-Universität zu Berlin - PhilFak I, Institut für Bibliotheks- und Informationswissenschaft;Gesetz zur Angleichung des Urheberrechts an die aktuellen Erfordernisse der Wissensgesellschaft (UrhWissG);https://www.bmjv.de/SharedDocs/Gesetzgebungsverfahren/DE/UrhWissG.html;17. Feb 17;https://www.bmjv.de//SharedDocs/Gesetzgebungsverfahren/Stellungnahmen/2017/Downloads/02172017_Stellungnahme_Steinhauer_HUBerlin_RefE_UrhWissG.pdf?__blob=publicationFile&v=3;NA;NA;
Prof. Dr. Markus Artz - Fakultät für Rechtswissenschaft - Forschungsstelle für Immobilienrecht;Gesetz zur Dämpfung des Mietanstiegs auf angespannten Wohnungsmärkten und zur Stärkung des Bestellerprinzips bei der Wohnungsvermittlung;https://www.bmjv.de/SharedDocs/Gesetzgebungsverfahren/DE/Daempfung_Mietanstieg_Wohnungsmaerkte_Staerkung_Bestellerprinzip_Wohnungsvermittlung.html;30. Okt 14;https://www.bmjv.de//SharedDocs/Gesetzgebungsverfahren/Stellungnahmen/2014/Downloads/10302014_Stellungnahme_Artz_RefE_MietNovG.pdf?__blob=publicationFile&v=1;NA;NA;
Prof. Dr. Martin Eifert und Johannes Gerberding;Gesetz zur Verbesserung der Rechtsdurchsetzung in sozialen Netzwerken (Netzwerkdurchsetzungsgesetz – NetzDG);https://www.bmjv.de/SharedDocs/Gesetzgebungsverfahren/DE/NetzDG.html;29. Mrz 17;https://www.bmjv.de//SharedDocs/Gesetzgebungsverfahren/Stellungnahmen/2017/Downloads/03292017_Stellungnahme_HUBerlin_RefE_NetzDG.pdf?__blob=publicationFile&v=3;NA;NA;
Prof. Dr. Michael Kubiciel - Lehrstuhl für Strafrecht, Strafrechtstheorie und Strafrechtsvergleichung, Universität zu Köln;Gesetz zu dem Strafrechtsübereinkommen des Europarates vom 27. Januar 1999 über Korruption und dem Zusatzprotokoll vom 15. Mai 2003 zum Strafrechtsübereinkommen des Europarates über Korruption;https://www.bmjv.de/SharedDocs/Gesetzgebungsverfahren/DE/Vertragsgesetz_Korruption.html;26. Apr 16;https://www.bmjv.de//SharedDocs/Gesetzgebungsverfahren/Stellungnahmen/2016/Downloads/04262016_Stellungnahme_Uni_Koeln_RefE_Strafrechts%C3%BCbereinkommen_Korruption.pdf?__blob=publicationFile&v=3;16/5240;NA;
Prof. Dr. Michael Kubiciel, Lehrstuhl für Strafrecht, Strafrechtstheorie und Strafrechtsvergleichung, Universität zu Köln;Gesetz zur Bekämpfung von Korruption im Gesundheitswesen;https://www.bmjv.de/SharedDocs/Gesetzgebungsverfahren/DE/Bekaempfung_Korruption_Gesundheitswesen.html;01. Mai 14;https://www.bmjv.de//SharedDocs/Gesetzgebungsverfahren/Stellungnahmen/2014/Downloads/05012014_Stellungnahme_Kubiciel2_RefE_Bekaempfung_Korruption_Gesundheitswesen.pdf?__blob=publicationFile&v=1;18/6446;NA;
Prof. Dr. Michael Kubiciel, Lehrstuhl für Strafrecht, Strafrechtstheorie und Strafrechtsvergleichung, Universität zu Köln, unter Mitwirkung von Wiss. Mit. Cornelia Spörl, LL.M.;Gesetz zur Bekämpfung der Korruption;https://www.bmjv.de/SharedDocs/Gesetzgebungsverfahren/DE/Bekaempfung_Korruption.html;01. Apr 14;https://www.bmjv.de//SharedDocs/Gesetzgebungsverfahren/Stellungnahmen/2014/Downloads/04012014_Stellungnahme_Kubiciel_RefE_Bekaempfung_Korruption.pdf?__blob=publicationFile&v=1;18/4350;NA;
Prof. Dr. Thomas Feltes, Lehrstuhl für Kriminologie, Kriminalpolitik und Polizeiwissenschaft, Ruhr-Universität Bochum, und Detlef Kabuth, Doktorand an der juristischen Fakultät der RUB;Gesetz zur Änderung des Strafgesetzbuches – Strafbarkeit von Sportwettbetrug und der Manipulation berufssportlicher Wettbewerbe;https://www.bmjv.de/SharedDocs/Gesetzgebungsverfahren/DE/Strafbarkeit_Sportwettbetrug_und_Manipulation_berufssportlicher_Wettbewerbe.html;11. Jan 16;https://www.bmjv.de//SharedDocs/Gesetzgebungsverfahren/Stellungnahmen/2016/Downloads/01112016_Stellungnahme_Thomas_Feltes_und_Detlef_Kabuth_RefE_Sportwettbetrug_und_Manipulation_berufssportlicher_Wettbewerbe.pdf?__blob=publicationFile&v=1;NA;NA;
Prof. Dr. Thomas Hoeren der Universität Münster;Gesetz zur Verbesserung der Rechtsdurchsetzung in sozialen Netzwerken (Netzwerkdurchsetzungsgesetz – NetzDG);https://www.bmjv.de/SharedDocs/Gesetzgebungsverfahren/DE/NetzDG.html;30. Mrz 17;https://www.bmjv.de//SharedDocs/Gesetzgebungsverfahren/Stellungnahmen/2017/Downloads/03302017_Stellungnahme_Uni_Muenster_RefE_NetzDG.pdf?__blob=publicationFile&v=2;NA;NA;
Professor Dr. Helmut Frister, Heinrich-Heine-Universität Düsseldorf;Gesetz zur Bekämpfung von Korruption im Gesundheitswesen;https://www.bmjv.de/SharedDocs/Gesetzgebungsverfahren/DE/Bekaempfung_Korruption_Gesundheitswesen.html;11. Mrz 15;https://www.bmjv.de//SharedDocs/Gesetzgebungsverfahren/Stellungnahmen/2015/Downloads/03112015_Stellungnahme_Frister_RefE_Bekaempfung_Korruption_Gesundheitswesen.pdf?__blob=publicationFile&v=1;18/6446;NA;
ProSiebenSat.1 Media SE;Gesetz zur verbesserten Durchsetzung des Anspruchs der Urheber und ausübenden Künstler auf angemessene Vergütung und zur Regelung von Fragen der Verlegerbeteiligung;https://www.bmjv.de/SharedDocs/Gesetzgebungsverfahren/DE/Urhebervertragsrecht.html;01. Dez 15;https://www.bmjv.de//SharedDocs/Gesetzgebungsverfahren/Stellungnahmen/2015/Downloads/12012015_Stellungnahme_prosieben_RefE_Urhebervertragsrecht.pdf?__blob=publicationFile&v=1;18/8625;NA;
Rates für nachhaltige Entwicklung (RNE);Gesetz zur Stärkung der nichtfinanziellen Berichterstattung der Unternehmen in ihren Lage- und Konzernlageberichten (CSR-Richtlinie-Umsetzungsgesetz);https://www.bmjv.de/SharedDocs/Gesetzgebungsverfahren/DE/CSR-Richtlinie-Umsetzungsgesetz.html;14. Apr 16;https://www.bmjv.de//SharedDocs/Gesetzgebungsverfahren/Stellungnahmen/2016/Downloads/04142016_Stellungnahme_Rat_f%C3%BCr_NACHHALTIGE_Entwicklung_RefE_CSR_Umsetzungsgesetz.pdf?__blob=publicationFile&v=3;NA;NA;
RDA Internationaler Bustouristikverband e. V.;Drittes Gesetz zur Änderung reiserechtlicher Vorschriften – Umsetzung der neuen EU-Pauschalreiserichtlinie;https://www.bmjv.de/SharedDocs/Gesetzgebungsverfahren/DE/Drittes_Gesetz_Pauschalreiserichtlinie.html;29. Jul 16;https://www.bmjv.de//SharedDocs/Gesetzgebungsverfahren/Stellungnahmen/2016/Downloads/07292016_Stellungnahme_RDA_RefE_Reiserecht.pdf?__blob=publicationFile&v=1;15/3442;NA;
Recht Würde Helfen e. V. - Institut für Opferschutz im Strafverfahren e. V.;Gesetz zur Stärkung der Opferrechte im Strafverfahren (3. Opferrechtsreformgesetz);https://www.bmjv.de/SharedDocs/Gesetzgebungsverfahren/DE/Staerkung_Opferrechte_Strafverfahren.html;10. Dez 14;https://www.bmjv.de//SharedDocs/Gesetzgebungsverfahren/Stellungnahmen/2014/Downloads/12102014_Stellungnahme_Opferschutz_im_Strafverfahren_RefE_Staerkung_Opferrechte_Strafverfahren.pdf?__blob=publicationFile&v=1;NA;NA;
Rechtsanwalt Dr. Oliver Jakob, Fachanwalt für Insolvenzrecht;Gesetz zur Änderung des Sachverständigenrechts und zur weiteren Änderung des Gesetzes über das Verfahren in Familiensachen und in den Angelegenheiten der freiwilligen Gerichtsbarkeit;https://www.bmjv.de/SharedDocs/Gesetzgebungsverfahren/DE/Aenderung_Sachverstaendigenrechts_Aenderung_Gesetzes_Verfahren_Familiensachen_sowie_freiwilligen_Gerichtsbarkeit.html;07. Aug 15;https://www.bmjv.de//SharedDocs/Gesetzgebungsverfahren/Stellungnahmen/2015/Downloads/08072015_Stellungnahme_Jakob_RefE_FamFG_AendG.pdf?__blob=publicationFile&v=1;18/6985;NA;
Rechtsanwalt Dr. Reber in Anwaltskanzlei Dr. Roth & Kollegen;Gesetz zur verbesserten Durchsetzung des Anspruchs der Urheber und ausübenden Künstler auf angemessene Vergütung und zur Regelung von Fragen der Verlegerbeteiligung;https://www.bmjv.de/SharedDocs/Gesetzgebungsverfahren/DE/Urhebervertragsrecht.html;03. Dez 15;https://www.bmjv.de//SharedDocs/Gesetzgebungsverfahren/Stellungnahmen/2015/Downloads/12032015_Stellungnahme_Reber_RefE_Urhebervertragsrecht.pdf?__blob=publicationFile&v=1;18/8625;NA;
Rechtsanwalt Norbert Küster;Gesetz zur Angleichung des Urheberrechts an die aktuellen Erfordernisse der Wissensgesellschaft (UrhWissG);https://www.bmjv.de/SharedDocs/Gesetzgebungsverfahren/DE/UrhWissG.html;18. Apr 17;https://www.bmjv.de//SharedDocs/Gesetzgebungsverfahren/Stellungnahmen/2017/Downloads/04182017_Stellungnahme_Kuester_RefE_UrhWissG.pdf?__blob=publicationFile&v=2;NA;NA;
Rechtsanwalt Struppler, Fachanwalt für Urheber- und Medienrecht;Gesetz zur verbesserten Durchsetzung des Anspruchs der Urheber und ausübenden Künstler auf angemessene Vergütung und zur Regelung von Fragen der Verlegerbeteiligung;https://www.bmjv.de/SharedDocs/Gesetzgebungsverfahren/DE/Urhebervertragsrecht.html;23. Dez 15;https://www.bmjv.de//SharedDocs/Gesetzgebungsverfahren/Stellungnahmen/2015/Downloads/12232015_Stellungnahme_Beisler_RefE_Urhebervertragsrecht.pdf?__blob=publicationFile&v=2;18/8625;NA;
Rechtsanwälte BRANDI Partnerschaft mdB, Herrn Rechtsanwalt Dr. Behrendt;Gesetz zur Verbesserung der Rechtssicherheit bei Anfechtungen nach der Insolvenzordnung und nach dem Anfechtungsgesetz;https://www.bmjv.de/SharedDocs/Gesetzgebungsverfahren/DE/Anfechtungsgesetz.html;26. Mrz 15;https://www.bmjv.de//SharedDocs/Gesetzgebungsverfahren/Stellungnahmen/2015/Downloads/03262015_Stellungnahme_RAe_Behrendt_BRANDI_RefE_Anfechtungsgesetz.pdf?__blob=publicationFile&v=1;18/7054;NA;
