Deutscher Landkreistag;Gesetz zur Änderung des Strafgesetzbuches - Umsetzung europäischer Vorgaben zum Sexualstrafrecht;https://www.bmjv.de/SharedDocs/Gesetzgebungsverfahren/DE/Aenderung_Strafgesetzbuches_Umsetzung_europaeischer_Vorgaben_Sexualstrafrecht.html;21. Jul 14;https://www.bmjv.de//SharedDocs/Gesetzgebungsverfahren/Stellungnahmen/2014/Downloads/07212014_Stellungnahme_Deutscher_Landkreistag_RefE_Aenderung_Strafgesetzbuch_Umsetzung_europaeischer_Vorgaben_Sexualstrafrecht.pdf?__blob=publicationFile&v=1;NA;147;
Deutscher Landkreistag;Gesetz zur Stärkung der Rechte von Betroffenen bei Fixierungen im Rahmen von Freiheitsentziehungen;https://www.bmjv.de/SharedDocs/Gesetzgebungsverfahren/DE/Fixierungen_Freiheitsenziehung.html;01. Mrz 19;https://www.bmjv.de//SharedDocs/Gesetzgebungsverfahren/Stellungnahmen/2019/Downloads/03012019_Stellungnahme_DLKT_Fixierungen.pdf?__blob=publicationFile&v=2;NA;147;
Deutscher Landkreistag;Gesetz zur Angleichung des Urheberrechts an die aktuellen Erfordernisse der Wissensgesellschaft (UrhWissG);https://www.bmjv.de/SharedDocs/Gesetzgebungsverfahren/DE/UrhWissG.html;27. Feb 17;https://www.bmjv.de//SharedDocs/Gesetzgebungsverfahren/Stellungnahmen/2017/Downloads/02222017_Stellungnahme_DLT_RefE_UrhWissG.pdf?__blob=publicationFile&v=2;NA;147;
Deutscher Landkreistag;Gesetz zur Einführung eines familiengerichtlichen Genehmigungsvorbehaltes für freiheitsentziehende Maßnahmen bei Kindern;https://www.bmjv.de/SharedDocs/Gesetzgebungsverfahren/DE/Genehmigungsvorbehalt_freiheitsentziehende_Massnahmen_Kindern.html;30. Sep 16;https://www.bmjv.de//SharedDocs/Gesetzgebungsverfahren/Stellungnahmen/2016/Downloads/09302016_Stellungnahme_Deutscher_Landkreistag_RefE_Genehmigungsvorbehalt_freiheitsentziehende_Massnahmen_Kindern.pdf?__blob=publicationFile&v=1;NA;147;
Deutscher Landkreistag;Gesetz zur Förderung der Freizügigkeit von EU-Bürgerinnen und -Bürgern sowie zur Neuregelung verschiedener Aspekte des Internationalen Adoptionsrechts;https://www.bmjv.de/SharedDocs/Gesetzgebungsverfahren/DE/Freizuegigkeit_EU.html;10. Jul 18;https://www.bmjv.de//SharedDocs/Gesetzgebungsverfahren/Stellungnahmen/2018/Downloads/07102018_Landkreistag_Freizuegigkeit.pdf?__blob=publicationFile&v=2;NA;147;
Deutscher Landkreistag;Gesetz zur Reform des Vormundschaftsrechts;https://www.bmjv.de/SharedDocs/Gesetzgebungsverfahren/DE/Reform_Vormundschaftsrecht.html;29. Nov 18;https://www.bmjv.de//SharedDocs/Gesetzgebungsverfahren/Stellungnahmen/2019/Downloads/11292018_Stellungnahme_Dt-Landkreistag_2-Diskussionsteilentwurf_Vormundschaftsrecht.pdf?__blob=publicationFile&v=2;NA;147;
Deutscher Landkreistag;Gesetzes zur Änderung des Unterhaltsrechts und des Unterhaltsverfahrensrechts sowie zur Änderung der Zivilprozessordnung und kostenrechtlicher Vorschriften   ;https://www.bmjv.de/SharedDocs/Gesetzgebungsverfahren/DE/Aenderung_Unterhaltsverfahrensrecht_Mindestunterhalt_saechliches-Existenminimum.html;07. Jul 15;https://www.bmjv.de//SharedDocs/Gesetzgebungsverfahren/Stellungnahmen/2015/Downloads/07072015_Stellungnahme_Dt_Landkreistag_RefE_GE_Aenderung_Unterhaltsrecht.pdf?__blob=publicationFile&v=1;NA;147;
Deutscher Leichtathletik-Verband (DLV);Gesetz zur Bekämpfung von Doping im Sport;https://www.bmjv.de/SharedDocs/Gesetzgebungsverfahren/DE/Bekaempfung_Doping_Sport.html;25. Feb 15;https://www.bmjv.de//SharedDocs/Gesetzgebungsverfahren/Stellungnahmen/2015/Downloads/02252015_Stellungnahme_DLV_RefE_AntiDopG.pdf?__blob=publicationFile&v=1;18/4898;5931;
Deutscher Mieterbund e. V. (DMB);Gesetz zur Änderung des Sachverständigenrechts und zur weiteren Änderung des Gesetzes über das Verfahren in Familiensachen und in den Angelegenheiten der freiwilligen Gerichtsbarkeit;https://www.bmjv.de/SharedDocs/Gesetzgebungsverfahren/DE/Aenderung_Sachverstaendigenrechts_Aenderung_Gesetzes_Verfahren_Familiensachen_sowie_freiwilligen_Gerichtsbarkeit.html;24. Jun 15;https://www.bmjv.de//SharedDocs/Gesetzgebungsverfahren/Stellungnahmen/2015/Downloads/06242015_Stellungnahme_DMB_RefE_FamFG_AendG.pdf?__blob=publicationFile&v=1;18/6985;357;
Deutscher Mieterbund e. V. (DMB);Gesetz zur Dämpfung des Mietanstiegs auf angespannten Wohnungsmärkten und zur Stärkung des Bestellerprinzips bei der Wohnungsvermittlung;https://www.bmjv.de/SharedDocs/Gesetzgebungsverfahren/DE/Daempfung_Mietanstieg_Wohnungsmaerkte_Staerkung_Bestellerprinzip_Wohnungsvermittlung.html;21. Mai 14;https://www.bmjv.de//SharedDocs/Gesetzgebungsverfahren/Stellungnahmen/2014/Downloads/05212014_Stellungnahme_DMB_RefE_MietNovG.pdf?__blob=publicationFile&v=3;NA;357;
Deutscher Mieterbund e. V. (DMB);Verbraucherstreitbeilegungsgesetz;https://www.bmjv.de/SharedDocs/Gesetzgebungsverfahren/DE/Verbraucherstreitbeilegungsgesetz_ADR_Richtlinie.html;29. Jan 15;https://www.bmjv.de//SharedDocs/Gesetzgebungsverfahren/Stellungnahmen/2015/Downloads/01292015_Stellungnahme_DMB_RefE_Verbraucherstreitbeilegungsgesetz_ADR_Richtlinie.pdf?__blob=publicationFile&v=1;NA;357;
Deutscher Museumsbund e. V.;Gesetz zur Umsetzung der Richtlinie 2014/26/EU über die kollektive Wahrnehmung von Urheber- und verwandten Schutzrechten und die Vergabe von Mehrgebietslizenzen für Rechte an Musikwerken für die Online-Nutzung im Binnenmarkt sowie zur Änderung des Verfahrens betreffend die Geräte- und Speichermedienvergütung;https://www.bmjv.de/SharedDocs/Gesetzgebungsverfahren/DE/VG_Richtlinie_Umsetzungsgesetz.html;22. Sep 15;https://www.bmjv.de//SharedDocs/Gesetzgebungsverfahren/Stellungnahmen/2015/Downloads/09222015_Stellungnahme_Deutscher_Museumsbund_RefE_VG_Richtlinie_Umsetzungsgesetz.pdf?__blob=publicationFile&v=1;18/7223;3805;
Deutscher Museumsbund e.V.;EU-Urheberrechtsreform („2. Copyright-Package“);https://www.bmjv.de/SharedDocs/Gesetzgebungsverfahren/DE/EU-Urheberrechtsreform_2Copyright-Package.html;28. Okt 16;https://www.bmjv.de//SharedDocs/Gesetzgebungsverfahren/Stellungnahmen/2016/Downloads/10282016_Stellungnahme_DMB_EU-Urheberrechtsreform.pdf?__blob=publicationFile&v=2;15/3169;3805;
Deutscher Museumsbund e.V.;Gesetz zur Angleichung des Urheberrechts an die aktuellen Erfordernisse der Wissensgesellschaft (UrhWissG);https://www.bmjv.de/SharedDocs/Gesetzgebungsverfahren/DE/UrhWissG.html;29. Mai 17;https://www.bmjv.de//SharedDocs/Gesetzgebungsverfahren/Stellungnahmen/2017/Downloads/05292017_Stellungnahme_Museumsbund_RefE_UrhWissG.pdf?__blob=publicationFile&v=2;NA;3805;
Deutscher Museumsbund e.V.;Gesetz zur Angleichung des Urheberrechts an die aktuellen Erfordernisse der Wissensgesellschaft (UrhWissG);https://www.bmjv.de/SharedDocs/Gesetzgebungsverfahren/DE/UrhWissG.html;24. Feb 17;https://www.bmjv.de//SharedDocs/Gesetzgebungsverfahren/Stellungnahmen/2017/Downloads/02102017_Stellungnahme_BDM_RefE_UrhWissG.pdf?__blob=publicationFile&v=2;NA;3805;
Deutscher Musikrat;Gesetz zur Angleichung des Urheberrechts an die aktuellen Erfordernisse der Wissensgesellschaft (UrhWissG);https://www.bmjv.de/SharedDocs/Gesetzgebungsverfahren/DE/UrhWissG.html;27. Feb 17;https://www.bmjv.de//SharedDocs/Gesetzgebungsverfahren/Stellungnahmen/2017/Downloads/02222017_Stellungnahme_DMR_RefE_UrhWissG.pdf?__blob=publicationFile&v=2;NA;3806;
Deutscher Musikrat;Gesetz zur Umsetzung der Richtlinie 2014/26/EU über die kollektive Wahrnehmung von Urheber- und verwandten Schutzrechten und die Vergabe von Mehrgebietslizenzen für Rechte an Musikwerken für die Online-Nutzung im Binnenmarkt sowie zur Änderung des Verfahrens betreffend die Geräte- und Speichermedienvergütung;https://www.bmjv.de/SharedDocs/Gesetzgebungsverfahren/DE/VG_Richtlinie_Umsetzungsgesetz.html;14. Aug 15;https://www.bmjv.de//SharedDocs/Gesetzgebungsverfahren/Stellungnahmen/2015/Downloads/08142015_Stellungnahme_Musikrat_RefE_VG_Richtlinie_Umsetzungsgesetz.pdf?__blob=publicationFile&v=1;18/7223;3806;
Deutscher Musikverband e.V.;Gesetz zur Umsetzung der Marrakesch-Richtlinie über einen verbesserten Zugang zu urheberrechtlich geschützten Werken zugunsten von Menschen mit einer Seh- oder Lesebehinderung;https://www.bmjv.de/SharedDocs/Gesetzgebungsverfahren/DE/Marrakesch-Richtlinie.html;15. Mai 18;https://www.bmjv.de//SharedDocs/Gesetzgebungsverfahren/Stellungnahmen/2018/Downloads/051518_Marrakesch_Stellungnahme_Musikverband.pdf?__blob=publicationFile&v=1;NA;NA;
Deutscher Musikverleger-Verband e. V. (DMV);Gesetz zur verbesserten Durchsetzung des Anspruchs der Urheber und ausübenden Künstler auf angemessene Vergütung und zur Regelung von Fragen der Verlegerbeteiligung;https://www.bmjv.de/SharedDocs/Gesetzgebungsverfahren/DE/Urhebervertragsrecht.html;19. Nov 15;https://www.bmjv.de//SharedDocs/Gesetzgebungsverfahren/Stellungnahmen/2015/Downloads/11192015_Stellungnahme_DMV2_RefE_Urhebervertragsrecht.pdf?__blob=publicationFile&v=1;18/8625;3044;
Deutscher Musikverleger-Verband e. V. (DMV);Gesetz zur Umsetzung der Richtlinie 2014/26/EU über die kollektive Wahrnehmung von Urheber- und verwandten Schutzrechten und die Vergabe von Mehrgebietslizenzen für Rechte an Musikwerken für die Online-Nutzung im Binnenmarkt sowie zur Änderung des Verfahrens betreffend die Geräte- und Speichermedienvergütung;https://www.bmjv.de/SharedDocs/Gesetzgebungsverfahren/DE/VG_Richtlinie_Umsetzungsgesetz.html;20. Jul 15;https://www.bmjv.de//SharedDocs/Gesetzgebungsverfahren/Stellungnahmen/2015/Downloads/07202015_Stellungnahme_DMV_RefE_VG_Richtlinie_Umsetzungsgesetz.pdf?__blob=publicationFile&v=1;18/7223;3044;
Deutscher Musikverleger-Verband e.V.;EU-Urheberrechtsreform („2. Copyright-Package“);https://www.bmjv.de/SharedDocs/Gesetzgebungsverfahren/DE/EU-Urheberrechtsreform_2Copyright-Package.html;24. Okt 16;https://www.bmjv.de//SharedDocs/Gesetzgebungsverfahren/Stellungnahmen/2016/Downloads/10242016_Stellungnahme_DVM_EU-Urheberrechtsreform.pdf?__blob=publicationFile&v=2;15/3169;3044;
Deutscher Musikverleger-Verband e.V.;Gesetz zur Angleichung des Urheberrechts an die aktuellen Erfordernisse der Wissensgesellschaft (UrhWissG);https://www.bmjv.de/SharedDocs/Gesetzgebungsverfahren/DE/UrhWissG.html;24. Feb 17;https://www.bmjv.de//SharedDocs/Gesetzgebungsverfahren/Stellungnahmen/2017/Downloads/02222017_Stellungnahme_DMV_RefE_UrhWissG.pdf?__blob=publicationFile&v=2;NA;3044;
Deutscher Musikverlegerverband e. V. (DMV), Präsident;Gesetz zur verbesserten Durchsetzung des Anspruchs der Urheber und ausübenden Künstler auf angemessene Vergütung und zur Regelung von Fragen der Verlegerbeteiligung;https://www.bmjv.de/SharedDocs/Gesetzgebungsverfahren/DE/Urhebervertragsrecht.html;14. Dez 15;https://www.bmjv.de//SharedDocs/Gesetzgebungsverfahren/Stellungnahmen/2015/Downloads/12142015_Stellungnahme_DMV_RefE_Urhebervertragsrecht.pdf?__blob=publicationFile&v=1;18/8625;NA;
Deutscher Notarverein;Gesetz zur Umsetzung des Gesetzes zur Einführung des Rechts auf Eheschließung für Personen gleichen Geschlechts;https://www.bmjv.de/SharedDocs/Gesetzgebungsverfahren/DE/Eheoeffnung_BegleitG.html;13. Jun 18;https://www.bmjv.de//SharedDocs/Gesetzgebungsverfahren/Stellungnahmen/2018/Downloads/06132018_Stellungnahme_DNotV_RefE_EheoeffnungsbegleitG.pdf?__blob=publicationFile&v=1;NA;272;
Deutscher Notarverein;Gesetz zur Neuregelung des Schutzes von Geheimnissen bei der Mitwirkung Dritter an der Berufsausübung schweigepflichtiger Personen;https://www.bmjv.de/SharedDocs/Gesetzgebungsverfahren/DE/Neuregelung_Schutzes_von_Geheimnissen_bei_Mitwirkung_Dritter_an_der_Berufsausuebung_schweigepflichtiger_Personen.html;13. Jan 17;https://www.bmjv.de//SharedDocs/Gesetzgebungsverfahren/Stellungnahmen/2017/Downloads/01132017_Stellungnahme_DNotV_RefE_Schutz_von_Geheimnissen.pdf?__blob=publicationFile&v=2;NA;272;
Deutscher Notarverein;Gesetz zum Internationalen Güterrecht und zur Änderung von Vorschriften des Internationalen Privatrechts;https://www.bmjv.de/SharedDocs/Gesetzgebungsverfahren/DE/IntG%C3%BCRVG.html;06. Jul 18;https://www.bmjv.de//SharedDocs/Gesetzgebungsverfahren/Stellungnahmen/2018/Downloads/070618_Stellungnahme_Notarverein_RefE_Intern.Gueterrecht_intern.Privatrecht.pdf?__blob=publicationFile&v=4;17/5125;272;
Deutscher Notarverein;Viertes Gesetzes zur Änderung des Umwandlungsgesetzes;https://www.bmjv.de/SharedDocs/Gesetzgebungsverfahren/DE/Umwandlungsgesetz_viertes.html;18. Sep 18;https://www.bmjv.de//SharedDocs/Gesetzgebungsverfahren/Stellungnahmen/2018/Downloads/09182018_dnotv_Unwandlungsgesetz.pdf?__blob=publicationFile&v=2;NA;272;
Deutscher Notarverein;Gesetz zur Reform des Vormundschaftsrechts;https://www.bmjv.de/SharedDocs/Gesetzgebungsverfahren/DE/Reform_Vormundschaftsrecht.html;30. Nov 18;https://www.bmjv.de//SharedDocs/Gesetzgebungsverfahren/Stellungnahmen/2019/Downloads/11302018_Stellungnahme_Dt-Notarverein_2-Diskussionsteilentwurf_Vormundschaftsrecht.pdf?__blob=publicationFile&v=2;NA;272;
Deutscher Notarverein;Gesetz zur Umsetzung der Berufsanerkennungsrichtlinie und zur Änderung weiterer Vorschriften im Bereich der rechtsberatenden Berufe;https://www.bmjv.de/SharedDocs/Gesetzgebungsverfahren/DE/Berufsanerkennungsrichtlinie.html;23. Jun 16;https://www.bmjv.de//SharedDocs/Gesetzgebungsverfahren/Stellungnahmen/2016/Downloads/06232016_Stellungnahme_DNV_RefE_Berufsanerkennungsrichtlinie.pdf?__blob=publicationFile&v=3;NA;272;
Deutscher Notarverein;Evaluationsbericht zum Mediationsgesetz ;https://www.bmjv.de/SharedDocs/Gesetzgebungsverfahren/DE/Mediationsgesetz_Evaluationsbericht.html;28. Sep 17;https://www.bmjv.de//SharedDocs/Gesetzgebungsverfahren/Stellungnahmen/2017/Downloads/09282017_Stellungnahme_Evaluationsbericht-MediationsG_Notarverein.pdf?__blob=publicationFile&v=3;15/3045;272;
Deutscher Notarverein;Änderung der Verordnung zu öffentlichen Bekanntmachungen in Insolvenzverfahren im Internet;https://www.bmjv.de/SharedDocs/Gesetzgebungsverfahren/DE/Oeffentliche_Bekannmachung_im_insolvenzverfahren_im_internet.html;30. Aug 18;https://www.bmjv.de//SharedDocs/Gesetzgebungsverfahren/Stellungnahmen/2018/Downloads/083018_Stellungnahme_DNotV_InsoBekV.pdf?__blob=publicationFile&v=1;15/4119;272;
Deutscher Notarverein (DNotV);Gesetz zum Internationalen Erbrecht und zur Änderung von Vorschriften zum Erbschein;https://www.bmjv.de/SharedDocs/Gesetzgebungsverfahren/DE/Internationales_Erbrecht_Aenderung_Vorschriften_zum_Erbschein.html;04. Jun 14;https://www.bmjv.de//SharedDocs/Gesetzgebungsverfahren/Stellungnahmen/2014/Downloads/06042014_Stellungnahme_DNotV_RefE_IntErbRVG.pdf?__blob=publicationFile&v=1;17/4666 (neu);272;
Deutscher Notarverein (DNotV);Gesetz zur Umsetzung der Richtlinie 2012/17/EU in Bezug auf die Verknüpfung von Zentral-, Handels- und Gesellschaftsregistern in der Europäischen Union;https://www.bmjv.de/SharedDocs/Gesetzgebungsverfahren/DE/RegisterverknuepfungsG.html;11. Mrz 14;https://www.bmjv.de//SharedDocs/Gesetzgebungsverfahren/Stellungnahmen/2014/Downloads/03112014_Stellungnahme_DNotV_Registerverkn%C3%BCpfungsG.pdf?__blob=publicationFile&v=1;NA;272;
Deutscher Notarverein (DNotV);Vorschlag zur Änderung der Richtlinie 2013/34/EU im Hinblick auf die Offenlegung von Ertragsteuerinformationen;https://www.bmjv.de/SharedDocs/Gesetzgebungsverfahren/DE/Vorschlag_Richtlinie_EU_Offenlegung_Ertragssteuerinformationen.html;12. Mai 16;https://www.bmjv.de//SharedDocs/Gesetzgebungsverfahren/Stellungnahmen/2016/Downloads/05122016_Stellungnahme_DNotV_RefE_Ertragssteuerinformation.pdf?__blob=publicationFile&v=3;NA;272;
Deutscher Notarverein e. V.;Gesetz zur Förderung der Freizügigkeit von EU-Bürgerinnen und -Bürgern sowie zur Neuregelung verschiedener Aspekte des Internationalen Adoptionsrechts;https://www.bmjv.de/SharedDocs/Gesetzgebungsverfahren/DE/Freizuegigkeit_EU.html;06. Jul 18;https://www.bmjv.de//SharedDocs/Gesetzgebungsverfahren/Stellungnahmen/2018/Downloads/07062018_DNOTV_Freizuegigkeit.pdf?__blob=publicationFile&v=2;NA;272;
Deutscher Notarverein e. V. (DNotV);Gesetz zur Änderung der materiellen Zulässigkeitsvoraussetzungen von ärztlichen Zwangsmaßnahmen und zur Stärkung des Selbstbestimmungsrechts von Betreuten;https://www.bmjv.de/SharedDocs/Gesetzgebungsverfahren/DE/Gesetz_zur_Aenderung_materieller_Zulaessigkeitsvoraussetzungen_aerztlicher_Zwangsmassnahmen.html;03. Jan 17;https://www.bmjv.de//SharedDocs/Gesetzgebungsverfahren/Stellungnahmen/2017/Downloads/01032017_Stellungnahme_DNotV_RefE_Gesetz_zur_Aenderung_materieller_Zulaessigkeitsvoraussetzungen_aerztlicher_Zwangsmassnahmen.pdf?__blob=publicationFile&v=1;NA;272;
Deutscher Notarverein e. V. (DNotV);Gesetz zur Änderung des Aktiengesetzes (Aktienrechtsnovelle 2014);https://www.bmjv.de/SharedDocs/Gesetzgebungsverfahren/DE/Aktienrechtsnovelle.html;16. Jun 14;https://www.bmjv.de//SharedDocs/Gesetzgebungsverfahren/Stellungnahmen/2014/Downloads/06162014_Stellungnahme_DNotV_RefE_Aenderung_Aktiengesetz.pdf?__blob=publicationFile&v=1;NA;272;
Deutscher Notarverein e. V. (DNotV);Gesetz zur Umsetzung der Entscheidung des BVerfG zur Sukzessivadoption durch Lebenspartner;https://www.bmjv.de/SharedDocs/Gesetzgebungsverfahren/DE/Sukzessivadoption.html;17. Feb 14;https://www.bmjv.de//SharedDocs/Gesetzgebungsverfahren/Stellungnahmen/2014/Downloads/02172014_Stellungnahme_DNotV_RefE_Sukzessivadoption.pdf?__blob=publicationFile&v=2;NA;272;
Deutscher Notarverein e. V. (DNotV), Präsident;Gesetz zur Reform des Bauvertragsrechts und zur Änderung der kaufrechtlichen Mängelhaftung;https://www.bmjv.de/SharedDocs/Gesetzgebungsverfahren/DE/Bauvertragsrecht.html;12. Nov 15;https://www.bmjv.de//SharedDocs/Gesetzgebungsverfahren/Stellungnahmen/2015/Downloads/11122015_Stellungnahme_DNotV_RefE_Bauvertragsrecht.pdf?__blob=publicationFile&v=2;NA;272;
Deutscher Notarverein e. V., Präsident;Gesetz zur Verbesserung der Rechtssicherheit bei Anfechtungen nach der Insolvenzordnung und nach dem Anfechtungsgesetz;https://www.bmjv.de/SharedDocs/Gesetzgebungsverfahren/DE/Anfechtungsgesetz.html;11. Jun 15;https://www.bmjv.de//SharedDocs/Gesetzgebungsverfahren/Stellungnahmen/2015/Downloads/06112015_Stellungnahme_Notarverein_RefE_Anfechtungsgesetz.pdf?__blob=publicationFile&v=1;18/7054;272;
Deutscher Notarverein e.V. (DNotV);Drittes Gesetz zur Änderung der Insolvenzordnung;https://www.bmjv.de/SharedDocs/Gesetzgebungsverfahren/DE/Drittes_Gesetz_zur_Aenderung_der_Insolvenzordnung.html;12. Aug 16;https://www.bmjv.de//SharedDocs/Gesetzgebungsverfahren/Stellungnahmen/2016/Downloads/08122016_Stellungnahme_DNotV_RefE_InsO.pdf?__blob=publicationFile&v=2;16/126;272;
Deutscher Notarverein, Präsident;Verbraucherstreitbeilegungsgesetz;https://www.bmjv.de/SharedDocs/Gesetzgebungsverfahren/DE/Verbraucherstreitbeilegungsgesetz_ADR_Richtlinie.html;23. Jan 15;https://www.bmjv.de//SharedDocs/Gesetzgebungsverfahren/Stellungnahmen/2015/Downloads/01232015_Stellungnahme_Deutscher_Notarverein_RefE_Verbraucherstreitbeilegungsgesetz_ADR_Richtlinie.pdf?__blob=publicationFile&v=1;NA;NA;
Deutscher Olympischer Sportbund (DOSB);Gesetz zur Bekämpfung von Doping im Sport;https://www.bmjv.de/SharedDocs/Gesetzgebungsverfahren/DE/Bekaempfung_Doping_Sport.html;28. Jan 15;https://www.bmjv.de//SharedDocs/Gesetzgebungsverfahren/Stellungnahmen/2015/Downloads/01282015_Stellungnahme_DOSB_RefE_AntiDopG.pdf?__blob=publicationFile&v=1;18/4898;NA;
Deutscher Olympischer Sportbund (DOSB), Athletenkommission;Gesetz zur Bekämpfung von Doping im Sport;https://www.bmjv.de/SharedDocs/Gesetzgebungsverfahren/DE/Bekaempfung_Doping_Sport.html;20. Feb 15;https://www.bmjv.de//SharedDocs/Gesetzgebungsverfahren/Stellungnahmen/2015/Downloads/02202015_Stellungnahme_DOSB_Athletenkommission_RefE_AntiDopG.pdf?__blob=publicationFile&v=2;18/4898;NA;
Deutscher Olympischer Sportbund (DOSB), Deutscher Fußball-Bund (DFB), Deutsche Fußball Liga (DFL);Gesetz zur Änderung des Strafgesetzbuches – Strafbarkeit von Sportwettbetrug und der Manipulation berufssportlicher Wettbewerbe;https://www.bmjv.de/SharedDocs/Gesetzgebungsverfahren/DE/Strafbarkeit_Sportwettbetrug_und_Manipulation_berufssportlicher_Wettbewerbe.html;15. Jan 16;https://www.bmjv.de//SharedDocs/Gesetzgebungsverfahren/Stellungnahmen/2016/Downloads/01152016_Stellungnahme_DOSB_DFB_DFL_RefE_Sportwettbetrug_und_Manipulation_berufssportlicher_Wettbewerbe.pdf?__blob=publicationFile&v=1;NA;NA;
Deutscher Philologenverband;Gesetz zur Angleichung des Urheberrechts an die aktuellen Erfordernisse der Wissensgesellschaft (UrhWissG);https://www.bmjv.de/SharedDocs/Gesetzgebungsverfahren/DE/UrhWissG.html;27. Feb 17;https://www.bmjv.de//SharedDocs/Gesetzgebungsverfahren/Stellungnahmen/2017/Downloads/02222017_Stellungnahme_dphv_RefE_UrhWissG.pdf?__blob=publicationFile&v=2;NA;3052;
Deutscher Reiseverband e.V.;Drittes Gesetz zur Änderung reiserechtlicher Vorschriften – Umsetzung der neuen EU-Pauschalreiserichtlinie;https://www.bmjv.de/SharedDocs/Gesetzgebungsverfahren/DE/Drittes_Gesetz_Pauschalreiserichtlinie.html;29. Jul 16;https://www.bmjv.de//SharedDocs/Gesetzgebungsverfahren/Stellungnahmen/2016/Downloads/07292016_Stellungnahme_DRV_RefE_Reiserecht.pdf?__blob=publicationFile&v=2;15/3442;NA;
Deutscher Reiseverband e.V.;Gesetz zur Einführung einer zivilprozessualen Musterfeststellungsklage;https://www.bmjv.de/SharedDocs/Gesetzgebungsverfahren/DE/Musterfeststellungsklage.html;03. Apr 18;https://www.bmjv.de//SharedDocs/Gesetzgebungsverfahren/Stellungnahmen/2018/Downloads/04032018_Stellungnahme_DRV_MFK.pdf?__blob=publicationFile&v=1;NA;NA;
Deutscher Richterbund;"Gesetz zur Fortentwicklung des Rechts des Pfändungsschutzkontos
und zur Änderung von Vorschriften des Pfändungsschutzes (Pfändungsschutzkonto-Fortentwicklungsgesetz – PKoFoG)";https://www.bmjv.de/SharedDocs/Gesetzgebungsverfahren/DE/Pfaendungsschutzkonto-Fortentwicklungsgesetz.html;27. Dez 18;https://www.bmjv.de//SharedDocs/Gesetzgebungsverfahren/Stellungnahmen/2019/Downloads/12272018_Stellungnahme_DRB_Diskussionsteilentwurf_Pf%C3%A4ndungsschutzkonto.pdf?__blob=publicationFile&v=3;NA;131;
Deutscher Richterbund;Umsetzung der Richtlinie (EU) 2017/1371 des Europäischen Parlaments und des Rates vom 5. Juli 2017 über die strafrechtliche Bekämpfung von gegen die finanziellen Interessen der Union gerichtetem Betrug;https://www.bmjv.de/SharedDocs/Gesetzgebungsverfahren/DE/Umsetzung_RL-EU-2017-1371.html;01. Nov 18;https://www.bmjv.de//SharedDocs/Gesetzgebungsverfahren/Stellungnahmen/2018/Downloads/110118_TAE_Richtlinie_2017_1371.pdf?__blob=publicationFile&v=2;NA;131;
Deutscher Richterbund;Gesetz zur Dämpfung des Mietanstiegs auf angespannten Wohnungsmärkten und zur Stärkung des Bestellerprinzips bei der Wohnungsvermittlung;https://www.bmjv.de/SharedDocs/Gesetzgebungsverfahren/DE/Daempfung_Mietanstieg_Wohnungsmaerkte_Staerkung_Bestellerprinzip_Wohnungsvermittlung.html;01. Mai 14;https://www.bmjv.de//SharedDocs/Gesetzgebungsverfahren/Stellungnahmen/2014/Downloads/05012014_Stellungnahme_DRB_RefE_MietNovG.pdf?__blob=publicationFile&v=2;NA;131;
Deutscher Richterbund;Gesetz zur Erweiterung der Medienöffentlichkeit in Gerichtsverfahren und zur Verbesserung der Kommunikationshilfen für Sprach- und Hörbehinderte (EMöGG);https://www.bmjv.de/SharedDocs/Gesetzgebungsverfahren/DE/Erweiterung_Medienoeffentlichkeit_Gerichtsverfahren.html;08. Jul 16;https://www.bmjv.de//SharedDocs/Gesetzgebungsverfahren/Stellungnahmen/2016/Downloads/07082016_Stellungnahme_Deutscher_Richterbund_RefE_EMoeGG.pdf?__blob=publicationFile&v=3;NA;131;
Deutscher Richterbund;Gesetz zur Reform des Vormundschaftsrechts;https://www.bmjv.de/SharedDocs/Gesetzgebungsverfahren/DE/Reform_Vormundschaftsrecht.html;01. Nov 18;https://www.bmjv.de//SharedDocs/Gesetzgebungsverfahren/Stellungnahmen/2019/Downloads/11012018_Stellungnahme_DRB_2-Diskussionsteilentwurf_Vormundschaftsrecht.pdf?__blob=publicationFile&v=2;NA;131;
Deutscher Richterbund;Evaluationsbericht zum Mediationsgesetz ;https://www.bmjv.de/SharedDocs/Gesetzgebungsverfahren/DE/Mediationsgesetz_Evaluationsbericht.html;01. Okt 17;https://www.bmjv.de//SharedDocs/Gesetzgebungsverfahren/Stellungnahmen/2017/Downloads/10012017_Stellungnahme_Evaluationsbericht-MediationsG_Richterbung.pdf?__blob=publicationFile&v=3;15/3045;131;
Deutscher Richterbund;Gesetz zur Einführung eines Anspruchs auf Hinterbliebenengeld;https://www.bmjv.de/SharedDocs/Gesetzgebungsverfahren/DE/Hinterbliebenengeld.html;11. Jan 17;https://www.bmjv.de//SharedDocs/Gesetzgebungsverfahren/Stellungnahmen/2017/Downloads/01112017_Stellungnahme_DRB_RefE_Hinterbliebenengeld.pdf?__blob=publicationFile&v=1;NA;131;
Deutscher Richterbund;Gesetz zur Verbesserung der Rechtsdurchsetzung in sozialen Netzwerken (Netzwerkdurchsetzungsgesetz – NetzDG);https://www.bmjv.de/SharedDocs/Gesetzgebungsverfahren/DE/NetzDG.html;27. Mrz 17;https://www.bmjv.de//SharedDocs/Gesetzgebungsverfahren/Stellungnahmen/2017/Downloads/03272017_Stellungnahme_DRB_RefE_NetzDG.pdf?__blob=publicationFile&v=3;NA;131;
Deutscher Richterbund;Gesetz zur Stärkung der Rechte von Betroffenen bei Fixierungen im Rahmen von Freiheitsentziehungen;https://www.bmjv.de/SharedDocs/Gesetzgebungsverfahren/DE/Fixierungen_Freiheitsenziehung.html;01. Mrz 19;https://www.bmjv.de//SharedDocs/Gesetzgebungsverfahren/Stellungnahmen/2019/Downloads/03012019_Stellungnahme_DRB_Fixierungen.pdf?__blob=publicationFile&v=2;NA;131;
Deutscher Richterbund;Evaluationsbericht zum Mediationsgesetz ;https://www.bmjv.de/SharedDocs/Gesetzgebungsverfahren/DE/Mediationsgesetz_Evaluationsbericht.html;22. Dez 17;https://www.bmjv.de//SharedDocs/Gesetzgebungsverfahren/Stellungnahmen/2017/Downloads/12222017_Stellungnahme_Evaluationsbericht-MediationsG_Forum-Mediation.pdf?__blob=publicationFile&v=2;15/3045;131;
